{
  "schema_version": 1,
  "name": "Analytical circle",
  "provenance": "ApexLab generated analytical validation",
  "closed": true,
  "interpolation": "periodic_uniform_catmull_rom",
  "control_points": [
    {
      "x_m": 60.0,
      "y_m": 0.0,
      "left_width_m": 7,
      "right_width_m": 7
    },
    {
      "x_m": 59.71108360033182,
      "y_m": 5.881028419773636,
      "left_width_m": 7,
      "right_width_m": 7
    },
    {
      "x_m": 58.847116824193826,
      "y_m": 11.705419320967694,
      "left_width_m": 7,
      "right_width_m": 7
    },
    {
      "x_m": 57.41642014393253,
      "y_m": 17.41708063526774,
      "left_width_m": 7,
      "right_width_m": 7
    },
    {
      "x_m": 55.43277195067721,
      "y_m": 22.961005941905388,
      "left_width_m": 7,
      "right_width_m": 7
    },
    {
      "x_m": 52.9152758609013,
      "y_m": 28.283804209559857,
      "left_width_m": 7,
      "right_width_m": 7
    },
    {
      "x_m": 49.888176738152715,
      "y_m": 33.334213981176134,
      "left_width_m": 7,
      "right_width_m": 7
    },
    {
      "x_m": 46.38062720176422,
      "y_m": 38.06359704981873,
      "left_width_m": 7,
      "right_width_m": 7
    },
    {
      "x_m": 42.42640687119285,
      "y_m": 42.426406871192846,
      "left_width_m": 7,
      "right_width_m": 7
    },
    {
      "x_m": 38.06359704981873,
      "y_m": 46.38062720176422,
      "left_width_m": 7,
      "right_width_m": 7
    },
    {
      "x_m": 33.334213981176134,
      "y_m": 49.888176738152715,
      "left_width_m": 7,
      "right_width_m": 7
    },
    {
      "x_m": 28.283804209559868,
      "y_m": 52.915275860901296,
      "left_width_m": 7,
      "right_width_m": 7
    },
    {
      "x_m": 22.96100594190539,
      "y_m": 55.43277195067721,
      "left_width_m": 7,
      "right_width_m": 7
    },
    {
      "x_m": 17.41708063526774,
      "y_m": 57.41642014393253,
      "left_width_m": 7,
      "right_width_m": 7
    },
    {
      "x_m": 11.7054193209677,
      "y_m": 58.847116824193826,
      "left_width_m": 7,
      "right_width_m": 7
    },
    {
      "x_m": 5.881028419773646,
      "y_m": 59.71108360033181,
      "left_width_m": 7,
      "right_width_m": 7
    },
    {
      "x_m": 3.67394039744206e-15,
      "y_m": 60.0,
      "left_width_m": 7,
      "right_width_m": 7
    },
    {
      "x_m": -5.881028419773639,
      "y_m": 59.71108360033182,
      "left_width_m": 7,
      "right_width_m": 7
    },
    {
      "x_m": -11.705419320967692,
      "y_m": 58.847116824193826,
      "left_width_m": 7,
      "right_width_m": 7
    },
    {
      "x_m": -17.41708063526773,
      "y_m": 57.416420143932534,
      "left_width_m": 7,
      "right_width_m": 7
    },
    {
      "x_m": -22.961005941905384,
      "y_m": 55.43277195067721,
      "left_width_m": 7,
      "right_width_m": 7
    },
    {
      "x_m": -28.28380420955986,
      "y_m": 52.9152758609013,
      "left_width_m": 7,
      "right_width_m": 7
    },
    {
      "x_m": -33.33421398117612,
      "y_m": 49.88817673815272,
      "left_width_m": 7,
      "right_width_m": 7
    },
    {
      "x_m": -38.063597049818725,
      "y_m": 46.38062720176423,
      "left_width_m": 7,
      "right_width_m": 7
    },
    {
      "x_m": -42.426406871192846,
      "y_m": 42.42640687119285,
      "left_width_m": 7,
      "right_width_m": 7
    },
    {
      "x_m": -46.38062720176422,
      "y_m": 38.06359704981873,
      "left_width_m": 7,
      "right_width_m": 7
    },
    {
      "x_m": -49.88817673815272,
      "y_m": 33.334213981176134,
      "left_width_m": 7,
      "right_width_m": 7
    },
    {
      "x_m": -52.915275860901296,
      "y_m": 28.28380420955987,
      "left_width_m": 7,
      "right_width_m": 7
    },
    {
      "x_m": -55.43277195067721,
      "y_m": 22.961005941905395,
      "left_width_m": 7,
      "right_width_m": 7
    },
    {
      "x_m": -57.41642014393253,
      "y_m": 17.417080635267745,
      "left_width_m": 7,
      "right_width_m": 7
    },
    {
      "x_m": -58.847116824193826,
      "y_m": 11.705419320967717,
      "left_width_m": 7,
      "right_width_m": 7
    },
    {
      "x_m": -59.71108360033181,
      "y_m": 5.881028419773649,
      "left_width_m": 7,
      "right_width_m": 7
    },
    {
      "x_m": -60.0,
      "y_m": 7.34788079488412e-15,
      "left_width_m": 7,
      "right_width_m": 7
    },
    {
      "x_m": -59.71108360033182,
      "y_m": -5.881028419773635,
      "left_width_m": 7,
      "right_width_m": 7
    },
    {
      "x_m": -58.847116824193826,
      "y_m": -11.705419320967701,
      "left_width_m": 7,
      "right_width_m": 7
    },
    {
      "x_m": -57.416420143932534,
      "y_m": -17.417080635267727,
      "left_width_m": 7,
      "right_width_m": 7
    },
    {
      "x_m": -55.432771950677214,
      "y_m": -22.96100594190538,
      "left_width_m": 7,
      "right_width_m": 7
    },
    {
      "x_m": -52.9152758609013,
      "y_m": -28.283804209559857,
      "left_width_m": 7,
      "right_width_m": 7
    },
    {
      "x_m": -49.88817673815273,
      "y_m": -33.33421398117612,
      "left_width_m": 7,
      "right_width_m": 7
    },
    {
      "x_m": -46.38062720176423,
      "y_m": -38.06359704981872,
      "left_width_m": 7,
      "right_width_m": 7
    },
    {
      "x_m": -42.42640687119286,
      "y_m": -42.426406871192846,
      "left_width_m": 7,
      "right_width_m": 7
    },
    {
      "x_m": -38.063597049818746,
      "y_m": -46.3806272017642,
      "left_width_m": 7,
      "right_width_m": 7
    },
    {
      "x_m": -33.334213981176134,
      "y_m": -49.888176738152715,
      "left_width_m": 7,
      "right_width_m": 7
    },
    {
      "x_m": -28.283804209559875,
      "y_m": -52.915275860901296,
      "left_width_m": 7,
      "right_width_m": 7
    },
    {
      "x_m": -22.96100594190542,
      "y_m": -55.43277195067719,
      "left_width_m": 7,
      "right_width_m": 7
    },
    {
      "x_m": -17.417080635267748,
      "y_m": -57.41642014393253,
      "left_width_m": 7,
      "right_width_m": 7
    },
    {
      "x_m": -11.705419320967719,
      "y_m": -58.84711682419382,
      "left_width_m": 7,
      "right_width_m": 7
    },
    {
      "x_m": -5.881028419773627,
      "y_m": -59.71108360033182,
      "left_width_m": 7,
      "right_width_m": 7
    },
    {
      "x_m": -1.1021821192326178e-14,
      "y_m": -60.0,
      "left_width_m": 7,
      "right_width_m": 7
    },
    {
      "x_m": 5.881028419773606,
      "y_m": -59.71108360033182,
      "left_width_m": 7,
      "right_width_m": 7
    },
    {
      "x_m": 11.705419320967698,
      "y_m": -58.847116824193826,
      "left_width_m": 7,
      "right_width_m": 7
    },
    {
      "x_m": 17.417080635267723,
      "y_m": -57.416420143932534,
      "left_width_m": 7,
      "right_width_m": 7
    },
    {
      "x_m": 22.961005941905402,
      "y_m": -55.4327719506772,
      "left_width_m": 7,
      "right_width_m": 7
    },
    {
      "x_m": 28.283804209559854,
      "y_m": -52.9152758609013,
      "left_width_m": 7,
      "right_width_m": 7
    },
    {
      "x_m": 33.33421398117611,
      "y_m": -49.88817673815273,
      "left_width_m": 7,
      "right_width_m": 7
    },
    {
      "x_m": 38.06359704981874,
      "y_m": -46.38062720176421,
      "left_width_m": 7,
      "right_width_m": 7
    },
    {
      "x_m": 42.42640687119284,
      "y_m": -42.42640687119286,
      "left_width_m": 7,
      "right_width_m": 7
    },
    {
      "x_m": 46.3806272017642,
      "y_m": -38.06359704981875,
      "left_width_m": 7,
      "right_width_m": 7
    },
    {
      "x_m": 49.888176738152715,
      "y_m": -33.334213981176134,
      "left_width_m": 7,
      "right_width_m": 7
    },
    {
      "x_m": 52.91527586090129,
      "y_m": -28.28380420955988,
      "left_width_m": 7,
      "right_width_m": 7
    },
    {
      "x_m": 55.43277195067719,
      "y_m": -22.961005941905423,
      "left_width_m": 7,
      "right_width_m": 7
    },
    {
      "x_m": 57.41642014393253,
      "y_m": -17.41708063526775,
      "left_width_m": 7,
      "right_width_m": 7
    },
    {
      "x_m": 58.84711682419382,
      "y_m": -11.705419320967723,
      "left_width_m": 7,
      "right_width_m": 7
    },
    {
      "x_m": 59.71108360033182,
      "y_m": -5.881028419773631,
      "left_width_m": 7,
      "right_width_m": 7
    }
  ],
  "sector_boundaries_fraction": [
    0.3333333333333333,
    0.6666666666666666,
    1
  ]
}
